{
    "$id": "BadgeDataSchema",
    "description": "Schema for BadgeData",
    "$schema": "http://json-schema.org/draft-07/schema#",
    "type": "object",
    "properties": {
        "props": {
            "$ref": "#/definitions/Props"
        },
        "systemProps": {
            "$ref": "#/definitions/Props"
        },
        "periods": {
            "type": "object"
        },
        "bookmarks": {
            "$ref": "#/definitions/Bookmarks"
        },
        "earned": {
            "type": "array",
            "items": [
                {
                    "type": "object",
                    "properties": {
                        "id": {
                            "type": "string"
                        },
                        "lastEarned": {
                            "type": "string",
                            "pattern": "^([0-9]{4})-([0-9]{2})-([0-9]{2})T([0-9]{2}):([0-9]{2}):([0-9]{2}(?:\\.[0-9]*)?)((-([0-9]{2}):([0-9]{2})|Z)?)$"
                        },
                        "count": {
                            "type": "integer"
                        }
                    },
                    "required": [
                        "id",
                        "lastEarned",
                        "count"
                    ]
                }
            ]
        }
    },
    "required": [
        "systemProps",
        "props",
        "earned",
        "periods",
        "bookmarks"
    ],
    "definitions": {
        "Props": {
            "patternProperties": {
                "^.*$": {
                    "anyOf": [
                        {
                            "type": "string"
                        },
                        {
                            "type": "integer"
                        },
                        {
                            "type": "boolean"
                        }
                    ]
                }
            },
            "additionalProperties": false
        },
        "Bookmarks": {
            "patternProperties": {
                "^.*$": {
                    "type": "string",
                    "pattern": "^([0-9]{4})-([0-9]{2})-([0-9]{2})T([0-9]{2}):([0-9]{2}):([0-9]{2}(?:\\.[0-9]*)?)((-([0-9]{2}):([0-9]{2})|Z)?)$"
                }
            },
            "additionalProperties": false
        }
    }
}